Category,Press,Title,Link,Content
IT일반,서울경제,"방통위 김태규 ""구글·애플 반독점 행위, 단호한 규제 필요""",https://n.news.naver.com/mnews/article/011/0004400022,김태규 방송통신위원장 직무대행이 국회 과학기술정보방송통신위원회 국정감사에 참석해 국내에서의 구글과 애플 등 글로벌 빅테크들의 반독점 행위에 대해 단호한 대응을 예고했다. 또 공정거래위원회의 이동통신 3사에 대한 담합
IT일반,KBS,‘2024 한중일 e스포츠 대회’ 다음 달 1일 중국 청두서 개최,https://n.news.naver.com/mnews/article/056/0011813624,"‘2024 한중일 e스포츠 대회’가 다음 달 1일, 중국 청두에서 개최된다고 한국e스포츠협회가 오늘(7일) 밝혔습니다. 한중일 e스포츠 대회는 한국과 일본, 중국 정부가 주도하는 e스포츠 국가 대항전으로 올해 4회째"
IT일반,연합뉴스,"네이버 ""안심보장 프로그램으로 '짝퉁' 몰 월평균 1천개 차단""",https://n.news.naver.com/mnews/article/001/0014968715,네이버는 올해 구축한 안심보장 프로그램을 통해 월평균 1천개 정도의 위조상품 판매 몰을 사전 차단했다고 7일 밝혔다. 사전탐지 대응률은 90%대를 기록하고 있다. 네이버는 스마트스토어 가입단계부터 위조 상품 판매 이
IT일반,디지털데일리,"[뉴템] LG전자, ‘김치톡톡’ 2025년형 출시…냉기케어 시스템 강화",https://n.news.naver.com/mnews/article/138/0002183815,LG전자(대표 조주완)가 맞춤형 보관 기능을 탑재한 2025년형 'LG 디오스 오브제컬렉션 김치톡톡'을 출시했다고 7일 발표했다. 신제품은 LG전자만의 냉기케어 시스템으로 김치 맛에 대한 전문적인 보관과 숙성을 제공
IT일반,전자신문,데이터센터 '코리아 패싱'에도 범부처 대응 전무,https://n.news.naver.com/mnews/article/030/0003245312,글로벌 빅테크들이 우리나라 대신 경쟁국에 데이터센터를 설립하는 '코리아 패싱' 논란이 커지는 가운데서도 범부처 대응은 부족하다는 비판이 커지고 있다. 경쟁국들이 민관 힘을 합쳐 데이터센터 유치에 사활을 걸고 있는 것
IT일반,더팩트,"티맵, 데이터·AI 활용 비즈니스 성장 전략 세미나 개최",https://n.news.naver.com/mnews/article/629/0000326880,"티맵모빌리티·틱택코리아, 데이터 활용 실제 사례 소개 티맵모빌리티가 인공지능(AI) 학습 데이터 가공 및 수집 전문 기업 틱택코리아와 세미나를 연다. 티맵모빌리티는 틱택코리아와 오는 17일 서울 마포구 프론트윈에서"
IT일반,동아일보,삼키면 ‘행복 호르몬’ 팍팍 …과식 유발하는 놀라운 원인 밝혀져,https://n.news.naver.com/mnews/article/020/0003590926,맛있는 음식을 먹을 땐 절제가 잘 안 된다. 치킨이나 피자 딱 한 조각에서 멈추고 싶지만 그러지 못하는 경우가 허다하다. 이유가 뭘까. 답은 목에 있는 것 같다. 음식의 매혹적인 향과 맛에 이끌려 먹기 시작하지만 사
보안/해킹,전자신문,"모니터랩, 2024 하반기 신입·경력 공채",https://n.news.naver.com/mnews/article/030/0003245299,"모니터랩이 오는 21일까지 '2024 하반기 신입·경력 공개 채용'을 진행한다. 이번 공채는 연구개발, 기술지원, 보안관제, 영업 등 7개 부문에 걸쳐 총 16개 직무에서 지원자를 모집한다. 희망자는 모니터랩 채용"
보안/해킹,전자신문,"에이아이스페라 '크리미널IP', '하이브리드 애널리시스'에 위협 인텔리전스 통합",https://n.news.naver.com/mnews/article/030/0003245297,에이아이스페라가 미국의 글로벌 사이버보안 기업 크라우드스트라이크(CrowdStrike)가 소유한 악성코드 분석 플랫폼 '하이브리드 애널리시스'(Hybrid Analysis)에 '크리미널 IP'의 도메인 위협 인텔리전
보안/해킹,전자신문,"한싹 '패스가드 AM', 국정원 보안기능확인서 획득",https://n.news.naver.com/mnews/article/030/0003245287,"한싹의 시스템 접근제어 솔루션 '패스가드 AM'이 국가정보원으로부터 보안기능확인서를 획득했다. 보안기능확인서는 국정원의 엄격한 보안 기준을 충족한 정보보호 제품에 부여하는 인증으로, 보안성과 신뢰성을 공식적으로 인정"
보안/해킹,디지털데일리,"[국감2024] 딥페이크 칼질 언제쯤? ""범부처 종합대책 마련 중""",https://n.news.naver.com/mnews/article/138/0002183814,"올해 국정감사(이하 국감) 주요 화두로 '딥페이크'가 떠오른 가운데, 범부처 차원에서 종합대책을 준비하고 있는 것으로 나타났다. 김태규 방송통신위원장 직무대행은 7일 국회 과학기술정보방송통신위원회 국감에 출석해 ""("
보안/해킹,디지털데일리,사이버보안 인재 부족한데…화이트해커만 키우려는 한국?,https://n.news.naver.com/mnews/article/138/0002183803,"글로벌 정보기술(IT) 시장에서 보안 인력난은 숙원과제다. 사이버 공격 난도가 높아지고 있지만 이를 대응할 만한 인재가 충분하지 않아, 자칫 방패가 무너질 수 있다는 우려 섞인 목소리도 나오는 분위기다. 주요국에서는"
보안/해킹,전자신문,"정부 “中 틱톡, 정보통신망법·개인정보보호법 위반 가능성 점검”",https://n.news.naver.com/mnews/article/030/0003245208,"우리 정부가 중국 숏폼(짧은 영상) 공유 플랫 '틱톡'의 정보통신망법과 개인정보보호법 위반 가능성에 대한 점검에 착수했다. 7일 정보통신업계와 관계 당국 등에 따르면, 방송통신위원회는 틱톡이 정보통신망법을 위반했다고"
보안/해킹,디지털데일리,"에스앤피랩, '2024 우수 정보보호 기술·제품' 지정",https://n.news.naver.com/mnews/article/138/0002183790,에스앤피랩(이하 SNP랩)이 마이데이터 기술 경쟁력을 인정받았다. SNP랩은 온디바이스 마이데이터 플랫폼 기술이 '2024년 우수 정보보호 기술·제품'으로 지정됐다고 7일 밝혔다. 과학기술정보통신부(이하 과기정통부)
보안/해킹,뉴시스,"정부, 마케팅·광고 동의 강제 中 틱톡 조사 착수",https://n.news.naver.com/mnews/article/003/0012823665,최은수 송혜리 기자 = 정부가 숏폼 앱 틱톡'을 상대로 정보통신망법 및 개인정보보호법 위반 가능성을 들여다 보기로 했다. 7일 관계 당국 등에 따르면 방송통신위원회는 틱톡이 정보통신망법을 위반했다고 보고 조만간 조사
보안/해킹,디지털데일리,"모니터랩, 2024 하반기 신입·경력 공채…21일까지 접수",https://n.news.naver.com/mnews/article/138/0002183782,모니터랩이 신입 및 경력 직원을 모집한다. 모니터랩(대표이사 이광후)은 '2024 하반기 신입·경력 공개 채용(이하 공채)'을 진행한다고 7일 밝혔다. 접수 기간은 이달 7일부터 21일까지다. 이번 공채는 7개 부문
보안/해킹,디지털타임스,"정부 ""中 틱톡 개인정보법 위반 가능성…점검 착수""",https://n.news.naver.com/mnews/article/029/0002906888,정부가 개인정보 침해 논란을 빚은 중국 숏폼(짧은 영상) 어플리케이션(앱) '틱톡'의 개인정보보호법과 정보통신망법 위반 가능성에 대한 점검에 착수했다. 7일 정보통신업계와 관계 당국 등에 따르면 방송통신위원회는 틱톡
보안/해킹,디지털데일리,"아카마이, API 트래픽 분석 특화 '네이티브 커넥터' 제공",https://n.news.naver.com/mnews/article/138/0002183758,아카마이테크놀로지스가 애플리케이션프로그래밍인터페이스(API) 트래픽 분석을 강화할 새 제품군을 공개했다. 아카마이테크놀로지스(한국 대표 이경준)는 '아카마이 API 보안'과 '아카마이 커넥티드 클라우드'를 통합하는
보안/해킹,디지털데일리,"'메이드 인 코리아' 가면 쓴 중국산 CCTV…""국가기관 등에 3만대 설치""",https://n.news.naver.com/mnews/article/138/0002183754,국가 주요 시설에 '한국산'으로 위장한 중국 폐쇄회로(CC)TV가 다수 설치돼 있다는 조사 결과가 나왔다. 국회 과학기술정보방송통신위원회 소속 박충권 의원(국민의힘)이 방송통신위원회 등으로부터 제출받은 자료에 따르면
보안/해킹,디지털타임스,"""보안 경쟁력 강화한다""…현대오토에버, 사이버 시큐리티 사업부 출범",https://n.news.naver.com/mnews/article/029/0002906858,'서비스 보안실' 신설…모의해킹 훈련 강화 200여명 인력 투입…모빌리티 보안 영역 경쟁력 ↑ 현대오토에버가 자동차 보안 경쟁력을 강화하기 위해 최근 '사이버 시큐리티 사업부'를 출범하고 200여명의 인력을 투입했다
보안/해킹,파이낸셜뉴스,"한싹 '패스가드 AM', 국정원 보안기능확인서 획득",https://n.news.naver.com/mnews/article/014/0005249750,한싹은 시스템 접근제어 솔루션 ‘패스가드 AM(PassGuard Access Management)’이 국가정보원으로부터 보안기능확인서를 획득했다고 7일 밝혔다. 이번 인증을 통해 한싹은 시스템 보안 사업의 경쟁력을
보안/해킹,뉴시스,"한싹, '패스가드 AM' 보안기능확인서 획득…공공 제로 트러스트 시장 공략",https://n.news.naver.com/mnews/article/003/0012822946,"한싹은 시스템 접근제어 솔루션 '패스가드 AM'이 국가정보원으로부터 보안기능확인서를 획득했다고 7일 밝혔다. 이번 인증을 통해 한싹은 시스템 보안 사업의 경쟁력을 한층 강화하고, 공공 제로 트러스트(Zero Trus"
보안/해킹,디지털데일리,"한싹 '패스가드 AM', 국정원 보안기능확인서 획득",https://n.news.naver.com/mnews/article/138/0002183744,한싹의 시스템 접근제어 솔루션이 보안성과 안정성을 검증받았다. 한싹(대표이사 이주도)은 자사 '패스가드 AM(PassGuard Access Management)'이 국가정보원(이하 국정원)으로부터 보안기능확인서를 획
보안/해킹,뉴시스,"""국가주요시설·군부대·경찰청 등에 '중국산 CCTV' 약 3만대 설치돼""",https://n.news.naver.com/mnews/article/003/0012822911,"우리나라의 국가주요시설, 군부대, 지자체 등에 국내산으로 위장한 중국산 CCTV가 약 3만대 설치돼있는 것으로 나타났다. 7일 국회 과학기술정보방송통신위원회 소속 박충권 국민의힘 의원이 방송통신위원회 등으로부터 제출"
보안/해킹,연합뉴스,"KT, 오픈소스 소프트웨어 보안 관리체계 국제 표준 인증 획득",https://n.news.naver.com/mnews/article/001/0014967678,"KT가 오픈소스 소프트웨어 보안 관리 체계 강화를 위한 국제 표준 'ISO/IEC 18974'를 획득했다고 7일 밝혔다. 오픈소스 소프트웨어는 소스 코드가 공개돼 있어 폭넓게 활용할 수 있지만, 보안 취약점이 있을"
보안/해킹,뉴시스,"현대오토에버, 사이버 시큐리티 사업부 출범…""글로벌 톱 서비스 지향""",https://n.news.naver.com/mnews/article/003/0012822884,현대오토에버가 200명 규모의 사이버 시큐리티 사업부를 출범시켰다고 7일 밝혔다. 현대오토에버는 이번 사업부 출범으로 모빌리티 보안 영역에서 차별화된 경쟁력을 극대화한다는 방침이다. 사이버 시큐리티 사업부장은 지난
보안/해킹,연합뉴스,현대오토에버 모빌리티 보안 담당 사이버 시큐리티 사업부 출범,https://n.news.naver.com/mnews/article/001/0014967590,현대오토에버가 모빌리티 보안 영역의 경쟁력 강화를 위해 기존 정보보안센터를 '사이버 시큐리티 사업부'로 격상해 출범했다고 7일 밝혔다. 인력 규모는 200여 명이다. 사이버 시큐리티 사업부장은 지난 7월 보안총괄임원
보안/해킹,연합뉴스,"""작년 불법 스팸메시지 41억건…5년만에 3.4배 늘어""",https://n.news.naver.com/mnews/article/001/0014967416,"與 신성범 ""신고율 높여야…문자 발송업체 대응책도 절실"" 지난해 우리 국민이 받은 불법스팸 휴대전화 문자메시지가 약 41억 건에 달한다는 분석이 7일 나왔다. 국회 과학기술정보방송통신위원회 소속 국민의힘 신성범 의원"
보안/해킹,뉴시스,스팸문자 신고해도…'떴다방' 업체들 과태료 800억 체납,https://n.news.naver.com/mnews/article/003/0012822442,"올해 불법 스팸문자 신고가 역대 최고치를 기록할 것으로 전망되는 가운데, 이를 사전 예방하기 위한 제도 '대량문자 전송자격인증제' 역시 이행 강제성이 없어서 실효성 문제가 제기된다. 6일 국회 과학기술정보방송통신위원"
보안/해킹,전자신문,"“강의 부탁드립니다”…北 해킹조직, 특강 요청 위장한 스피어피싱 공격",https://n.news.naver.com/mnews/article/030/0003244954,북한 해킹그룹 김수키가 한국을 주요 거점으로 지능형지속위헙(APT) 공격을 이어오고 있다. 특히 김수키는 강연의뢰서 등으로 위장한 악성파일(문서)로 국내에서 활동하는 북한 전문가를 타깃으로 스피어 피싱 공격을 벌여
보안/해킹,디지털데일리,"독일 방산업체 해킹 시도한 北 '김수키', 한국 노렸나?",https://n.news.naver.com/mnews/article/138/0002183723,최근 북한 정찰총국 산하 해커조직 '김수키(Kimsuky)'가 독일 방산업체 해킹을 시도했다. 지난달 27일(현지시간) 독일 매체 슈피겔 등에 따르면 김수키는 독일 방산업체 딜디펜스에서 무기 관련 정보를 탈취하려고
보안/해킹,전자신문,"에스원, 가족 초청행사 새 패러다임 제시…“건강한 조직문화 확산 앞장”",https://n.news.naver.com/mnews/article/030/0003244880,에스원이 온·오프라인을 결합한 임직원 가족 초청행사 '한마음 페스티벌'을 개최하며 가족 초청 행사의 새로운 패러다임을 제시했다. 한마음페스티벌은 MZ 세대와 소통 강화를 위한 온라인 행사부터 다양한 세대로 구성된 임
보안/해킹,뉴스1,"방구석 댄스부터 e스포츠까지…에스원 ""뻔한 사내행사 아닙니다""",https://n.news.naver.com/mnews/article/421/0007826739,에스원(012750)은 최근 진행한 임직원 가족 초청 사내행사 '에스원 한마음 페스티벌'에 1400여명이 참석했다고 6일 밝혔다. 업무 연장으로 인식되던 사내행사에서 벗어나 온 가족이 즐길 만한 프로그램들로 꾸렸다는
보안/해킹,디지털데일리,"링크 단축기도 악용하는 공격자들, 디지털 도구 '무기화 시대'",https://n.news.naver.com/mnews/article/138/0002183710,"디지털 분석 도구(툴)는 사이버 공간에서 필수 요소로 꼽힌다. 링크 단축기는 물론, 위치 추적 시스템부터 디지털 광고 플랫폼까지 디지털 분석 툴은 사용자 편의를 높일 수 있는 영역에서 활약하고 있다. 그러나 좋은 목"
보안/해킹,뉴시스,中 성인 사이트에 올라온 韓 산부인과·탈의실 영상…어떻게 유출됐나,https://n.news.naver.com/mnews/article/003/0012820513,중국산 인터넷프로토콜(IP)카메라로 촬영된 한국인들의 사생활 영상이 대거 유포되며 적잖은 파장이 일고 있다. 최근 중국 음란물 사이트에 중국산 IP카메라로 촬영한 한국인들의 사생활 영상이 유포된 것으로 확인됐다. 해
보안/해킹,연합뉴스,발언하는 강석균 안랩 대표,https://n.news.naver.com/mnews/article/001/0014964898,지난 2일(현지 시각) 사우디아라비아 리야드에서 열린 'GCF 2024' 패널 토의에서 강석균 안랩 대표(오른쪽 두 번째)가 발언하고 있다. 2024.10.4 [안랩 제공. 재판매 및 DB 금지]
보안/해킹,연합뉴스,"안랩, 사우디 정부 주최 사이버보안 포럼 참가",https://n.news.naver.com/mnews/article/001/0014964792,안랩은 4일 강석균 대표가 지난 2~3일(현지 시각) 사우디아라비아 리야드에서 열린 국제 사이버 보안 포럼 'GCF 2024'에서 사이버 보안 산업의 발전 방안과 효과적인 위협 대응 기술 등을 논의했다고 전했다. G
컴퓨터,지디넷코리아,"서비스나우, 가트너 기술 워크플로 5개 부문 점유율 1위",https://n.news.naver.com/mnews/article/092/0002347804,"서비스나우가 2023년 가트너 시장 점유율 보고서에서 기술 워크플로 5개 부문 시장 점유율 1위, 1개 부문에서 시장 점유율 2위를 차지했다고 7일 밝혔다 1위를 달성한 분야는 IT옵스(ITOps), ITSM 플랫폼"
컴퓨터,지디넷코리아,국감 앞둔 개인정보위…'개인정보보호원' 설립 재논의하나,https://n.news.naver.com/mnews/article/092/0002347796,개인정보보호위원회가 국정감사를 하루 앞둔 가운데 21대 국회에서 불발됐던 '개인정보보호원' 설치 논의가 재부상할 가능성이 제기되고 있다. 7일 업계에 따르면 개인정보 오남용 방지책으로 해당 논의가 개인정보위 국감에서
컴퓨터,지디넷코리아,"다쏘시스템, 유럽연합 AI협약 서명…""윤리적 AI사용 선도""",https://n.news.naver.com/mnews/article/092/0002347795,다쏘시스템이 기업 혁신을 촉진하고 윤리적인 인공지능(AI) 사용을 장려하기 위해 적극 기여할 방침이다. 다쏘시스템은 유럽연합 집행위원회의 새로운 이니셔티브인 ‘AI 협약’에 서명했다고 7일 밝혔다. 이 협약은 유럽
컴퓨터,지디넷코리아,"""AI 챗봇으로 디지털 시대 선도""…솔트웨어, 국내 최대 디지털 이벤트 참가",https://n.news.naver.com/mnews/article/092/0002347792,솔트웨어가 국내 최대 인공지능(AI) 산업 전시회에서 기업용 AI 챗봇 '사피봇'을 발표하며 디지털 전환의 새로운 장을 연다. 솔트웨어는 오는 10일부터 사흘간 서울 코엑스에서 열리는 '디지털 혁신 페스타 2024(
컴퓨터,지디넷코리아,"""살해 협박까지?""…美 볼티모어 고교 교장, '딥페이크' 음성에 당했다",https://n.news.naver.com/mnews/article/092/0002347791,미국 메릴랜드주 볼티모어 지역의 한 고등학교 교장이 인공지능(AI)으로 조작된 음성으로 인해 살해 협박까지 받는 일이 발생했다. 흑인·유대인을 비하하는 내용이 담겨 있었기 때문이다. 7일 BBC 등 외신에 따르면 에
컴퓨터,지디넷코리아,"행안부 ""AI 활용해 공공서비스 혁신 강화""",https://n.news.naver.com/mnews/article/092/0002347787,행정안전부(행안부)가 인공지능(AI) 기술과 기관 간 협업을 통해 국민 삶의 질 개선에 박차를 가하고 있다. 행안부는 '2024 정부혁신 왕중왕전' 대회를 개최해 '문제를 해결하는 정부' 분야에서 다양한 혁신 사례를
컴퓨터,지디넷코리아,"[유미's 픽] ""몸값 최대 8.5兆?""…LG CNS, 맥쿼리 '엑시트' 전략에 IPO 흥행 달렸다",https://n.news.naver.com/mnews/article/092/0002347783,"내년 초 유가증권시장(코스피) 상장을 목표로 기업공개(IPO) 절차를 공식화 한 LG CNS가 장외시장에서 고공행진을 하고 있다. 기존 예상 기업가치는 7조원이지만, 여러 변수 속에서도 IPO 흥행에 성공할 경우 몸"
컴퓨터,지디넷코리아,"한전KDN, ‘빛가람 에너지밸리 ICT&보안 컨퍼런스’ 사전 접수 개시",https://n.news.naver.com/mnews/article/092/0002347780,한전KDN(대표 김장현)은 오는 31일 나주 본사 빛가람홀에서 개최하는 ‘2024 빛가람에너지밸리 ICT&보안 컨퍼런스’ 참가자를 모집한다. 올해 7회째를 맞는 컨퍼런스는 에너지 ICT 분야 최신 기술 발전과 AI·
컴퓨터,지디넷코리아,"""글로벌 한국어 교육 수요 급증""…LG CNS-지나인, AI 한국어 스피킹앱 협력",https://n.news.naver.com/mnews/article/092/0002347779,"지나인(대표 선현우, 최경은)이 급증하는 한국어 교육 수요에 발맞춰 인공지능(AI)기반 교육앱 개발에 나선다. 지나인은 LG CNS와 인공지능(AI) 기술을 활용한 한국어 스피킹 앱 공동 제작에 나선다고 7일 밝혔다"
컴퓨터,지디넷코리아,"'MSP 강자' 메가존클라우드, 3년 연속 초대형 부스 꾸민다",https://n.news.naver.com/mnews/article/092/0002347771,"메가존클라우드가 국내외 파트너사와 손잡고 멀티 클라우드 사업의 미래를 그리는 장을 마련했다. 인공지능(AI)을 비롯해 양자컴퓨팅, 서비스형 소프트웨어(SaaS) 등 최신 기술을 담은 클라우드 솔루션을 한 자리에 모아"
컴퓨터,디지털데일리,"한컴, 한글날 맞아 ‘한컴오피스 2024 특별판’ 출시",https://n.news.naver.com/mnews/article/138/0002183802,한글과컴퓨터(이하 한컴)는 한글날 578돌과 창립 34주년을 기념해 ‘한컴오피스 2024 특별판’을 출시한다고 7일 밝혔다. 이번 특별판은 국내 폰트 디자인 회사 릭스폰트와 협업해 다양하고 독창적인 서체를 함께 이용
컴퓨터,지디넷코리아,엣지 AI 혁신 선도하는 노타…'넷츠프레소'로 생성 AI 시대 앞장선다,https://n.news.naver.com/mnews/article/092/0002347770,엣지 AI 분야에서 혁신을 이끌어온 노타가 생성 인공지능(AI) 시대를 맞아 새롭게 주목받고 있다. 노타는 AI 모델의 경량화와 최적화를 통해 다양한 산업군에서 효율적인 AI 솔루션을 제공해왔다. 또 그간의 전문성과
컴퓨터,지디넷코리아,"그릿지, '디노 2024'에서 1대1 맞춤형 IT 컨설팅 상담 진행",https://n.news.naver.com/mnews/article/092/0002347765,"기업들의 개발 부서의 역량 강화와 프로젝트 관리 효율성을 높이기 위해 그릿지가 '디지털 혁신 페스타(DINNO, 디노) 2024'에서 맞춤 컨설팅에 나선다. 그릿지는 오는 10일 서울 강남구 삼성동 코엑스에서 열리는"
컴퓨터,지디넷코리아,"""행정망 먹통 막자""…2026년부터 공공 정보시스템 예방점검 체계 의무화",https://n.news.naver.com/mnews/article/092/0002347764,행정안전부가 지난 1월 발표한 '디지털 행정 서비스 국민 신뢰 제고 대책'의 후속 절차로 공공 시스템 점검 기준을 새로 선보인다. 행안부는 '정보시스템 예방점검 체계'와 '정보시스템 표준 운영절차'를 마련해 내년부터
컴퓨터,지디넷코리아,"한글과컴퓨터, 한글날 맞아 한정판으로 '이것' 내놓는다",https://n.news.naver.com/mnews/article/092/0002347763,한글과컴퓨터가 한글날 578돌과 회사 창립 34주년을 기념해 특별한 제품을 선보인다. 한글과컴퓨터는 '한컴오피스 2024 특별판'을 출시한다고 7일 밝혔다. 이번 특별판은 한글날을 기념하는 차원에서 출시된 한정판으로
컴퓨터,경향신문,"이재용, 필리핀서 삼성전기 전장사업 점검···‘기회 선점’ 강조",https://n.news.naver.com/mnews/article/032/0003324750,이재용 삼성전자 회장이 필리핀에 있는 삼성전기 적층세라믹커패시터(MLCC) 사업장을 찾는 등 자동차 전자장비(전장) 사업에 힘을 싣고 있다. 7일 삼성전자에 따르면 이 회장은 전날 필리핀 칼람바에 위치한 삼성전기 생
컴퓨터,지디넷코리아,"'글로벌 호텔' 하얏트, 오라클 만나 고객 응대 더 빨라졌다",https://n.news.naver.com/mnews/article/092/0002347759,글로벌 5성급 호텔인 '하얏트 호텔 코퍼레이션'이 보다 효율적인 고객 데이터 관리를 위해 오라클과 손을 잡는다. 오라클은 하얏트 호텔이 글로벌 호텔 포트폴리오의 자산 관리 시스템(PMS)으로 '오라클 오페라 클라우드
컴퓨터,지디넷코리아,"행안위, 김영섭 KT 대표 국감 증인 출석 취소",https://n.news.naver.com/mnews/article/092/0002347758,김영섭 KT 대표의 국회 행정안전위원회 국정감사 증인 출석이 취소됐다. 김 대표는 정부 행정정보망사업 장애 및 부실을 이유로 행안위 국감 참석이 예정된 바 있다. 7일 행안위에 따르면 김 대표의 행안위 국감 출석이
컴퓨터,경향신문,2025년형 ‘LG 디오스 오브제컬렉션 김치톡톡’ 출시…맞춤형 보관 기능 강화,https://n.news.naver.com/mnews/article/032/0003324749,| 최병태 기자 piano@kyunghyang.com LG전자는 7일 한층 진화된 기술과 맞춤형 보관 기능을 탑재한 2025년형 LG 디오스 오브제컬렉션 김치톡톡을 최근 새롭게 선보였다고 밝혔다. 신제품은 전통과 현
컴퓨터,디지털데일리,"행안부, 공공시스템 장애 예방점검·표준운영절차 도입",https://n.news.naver.com/mnews/article/138/0002183791,행정안전부는 공공 정보시스템의 장애 예방 및 장애 피해 최소화를 위한 ‘정보시스템 예방점검체계’와 ‘정보시스템 표준운영절차’를 마련해 내년부터 모든 공공기관에 적용을 권고한다고 7일 밝혔다. 기관별 준비 상황과 예산
