Category,Press,Title,Link,Content
컴퓨터,아이뉴스24,"현대오토에버, '사이버 시큐리티 사업부' 출범…""모빌리티 보안 경쟁력↑""",https://n.news.naver.com/mnews/article/031/0000874348,현대오토에버는 ‘사이버 시큐리티 사업부’를 출범했다고 7일 밝혔다. 인력규모는 200여명이다. 현대오토에버는 이번 사업부 출범으로 모빌리티 보안 영역에서 차별화된 경쟁력을 극대화한다는 방침이다. 사이버 시큐리티 사업
컴퓨터,지디넷코리아,"티맥스소프트, 클라우드 미들웨어 '제우스9'·'웹투비6' 출시",https://n.news.naver.com/mnews/article/092/0002347737,티맥스소프트가 효율적인 앱 개발과 유지보수 간소화를 위한 신규 클라우드 미들웨어를 선보인다. 티맥스소프트는 클라우드 미들웨어 제품 '제우스9(JEUS9)'과 '웹투비6(WebtoB6)'를 정식 출시했다고 7일 밝혔다
컴퓨터,디지털데일리,공모주 청약 정보 한눈에...네이버페이 ‘증권 공모주’ 서비스 출시,https://n.news.naver.com/mnews/article/138/0002183781,네이버페이가 공모주 특화 서비스를 선보인다. 네이버페이(대표 박상진)는 여러 증권사 공모주 청약 정보를 한 번에 모아볼 수 있는 네이버페이 ‘증권 공모주’ 서비스를 출시했다. 네이버페이 증권 공모주 서비스는 공모주에
컴퓨터,지디넷코리아,"베스핀글로벌, 日 MSP ‘탑게이트’ 인수…일본 시장 공략 '날개'",https://n.news.naver.com/mnews/article/092/0002347732,베스핀글로벌의 일본 합작법인 ‘지젠’이 일본 클라우드 관리 서비스 사업자(MSP) 탑게이트 인수 합병 절차를 완료했다. 베스핀글로벌은 이번 인수 합병을 통해 일본 구글 클라우드 파트너 기업 중 최상위 규모로 자리매김
컴퓨터,지디넷코리아,"에스넷시스템, 유한대학교와 AI인재 육성 경쟁력 확보",https://n.news.naver.com/mnews/article/092/0002347725,"에스넷시스템(대표 유홍준, 장병강)이 대학교에서 인공지능(AI) 인재를 조기에 육성해 경쟁력 확보에 나선다 에스넷시스템은 유한대학교와 산학협력을 체결하고, AI 분야의 우수 인재로 조기 육성하기 위한 프로그램을 시작"
컴퓨터,스포츠서울,"이재용 회장, MLCC 해외 생산거점 찾아 필리핀 ‘기회 선점’ 강조",https://n.news.naver.com/mnews/article/468/0001098029,삼성전자 이재용 회장이 지난 6일 필리핀법인(SEMPHIL)을 찾아 MLCC 제품 생산현장을 점검하고 있다. 사진 | 삼성전자 이재용 삼성전자 회장이 필리핀 삼성전기 적층세라믹커패시터(MLCC) 사업을 점검하고 ▲A
컴퓨터,지디넷코리아,"워크데이, 인사·재무 프로세스 혁신 ‘AI 에이전트’ 4종 공개",https://n.news.naver.com/mnews/article/092/0002347719,"워크데이가 인사 및 재무 업무 전반을 개선하기 위한 새로운 인공지능(AI) 에이전트 4종을 공개했다. 워크데이는 채용에이전트, 경비에이전트, 승계에이전트, 워크데이 옵티마이즈를 선보인다고 7일 밝혔다. 4종의 AI"
컴퓨터,아이뉴스24,"티맥스소프트, 클라우드 미들웨어 '제우스9·웹투비6' 출시",https://n.news.naver.com/mnews/article/031/0000874293,기업용 소프트웨어 전문기업 티맥스소프트는 향상된 프레임워크와 다양해진 기능으로 강화된 클라우드 미들웨어 제품 ‘제우스9(JEUS9)’과 ‘웹투비6(WebtoB6)’를 출시했다고 7일 밝혔다. 웹애플리케이션서버(WAS
컴퓨터,디지털데일리,"현대오토에버, ‘사이버 시큐리티 사업부’ 출범…“보안역량 결집”",https://n.news.naver.com/mnews/article/138/0002183763,현대오토에버는 최근 200여명 규모의 ‘사이버 시큐리티 사업부’를 출범했다고 7일 밝혔다. 사이버 시큐리티 사업부장은 지난 7월 현대오토에버가 보안총괄임원(CISO)으로 영입한 최원혁 상무가 맡는다. 최 상무는 정보
컴퓨터,아이뉴스24,"미소정보기술, 현대제철에 AI 자율공정제어 솔루션 '스마트VI' 구축",https://n.news.naver.com/mnews/article/031/0000874275,데이터 플랫폼 전문기업 미소정보기술은 현대제철에 특수강 최적 교정을 위한 인공지능(AI)자율제조 솔루션 ‘스마트VI(smart Vision Insight)’구축을 완료했다고 7일 밝혔다. 미소정보기술이 개발한 ‘스마
게임/리뷰,스포츠월드,"네오플, 제주도 내 발달장애아동 재활치료비 지원사업 진행",https://n.news.naver.com/mnews/article/396/0000690895,"정일영 네오플 경영지원총괄 이사, 김광수 제주특별자치도교육청 교육감, 변정근 초록우산 어린이재단 제주지역본부 본부장이 기념사진을 촬영하고 있다. 넥슨 제공 넥슨의 자회사 네오플이 제주특별자치도교육청 및 초록우산과 총"
게임/리뷰,디지털타임스,`인디` 초점 맞춘 지스타2024...스팀과 생태계 확장 나선다,https://n.news.naver.com/mnews/article/029/0002906990,"11월 14일 부산 벡스코에서 개최...'인디게임 쇼케이스' 진행 ""참가사 수요 충족에 초점""...참가 심사에만 일주일 이상 소요 2년 연속 핵심, 이용자 충성도 높은 서브컬처는 '불참' 국내 최대 게임쇼 지스타가"
게임/리뷰,지디넷코리아,"한국게임개발자협회 게임마당, 온라인 게임잼 참가자 접수",https://n.news.naver.com/mnews/article/092/0002347797,한국게임개발자협회는 7일 리소스 무료 공유 플랫폼 ‘게임마당’이 다음달 개최되는 온라인 게임잼의 참가 신청 접수를 시작했다고 밝혔다. 게임마당의 첫 게임잼은 게임개발에 관심 많고 경험이 있는 16세 이상 34세 이하
게임/리뷰,스포츠월드,"컴투스 그룹, 생물 다양성 증진 위해 ‘비오톱 만들기’ 봉사",https://n.news.naver.com/mnews/article/396/0000690894,봉사활동에 참여한 컴투스 그룹 임직원이 기념사진을 촬영하고 있다. 컴투스 제공 컴투스 그룹이 생물 다양성 증진과 도심 속 자연 생태계 보전을 위한 비오톱 만들기 환경봉사활동을 진행했다. 컴투스는 지난 5일 컴투스 그
게임/리뷰,이코노미스트,"넷마블 ‘킹 아서: 레전드 라이즈’, 공식 브랜드페이지 오픈",https://n.news.naver.com/mnews/article/243/0000065745,넷마블은 북미 자회사 카밤에서 개발 중인 출시 예정 신작 ‘킹 아서: 레전드 라이즈’의 공식 브랜드페이지를 오픈했다고 7일 밝혔다. 킹 아서: 레전드 라이즈는 수집형 전략 RPG로 이용자들은 게임의 주인공인 아서가
게임/리뷰,스포츠월드,"게임문화재단, 게임과몰입 문화예술 프로그램 체험교육 성료",https://n.news.naver.com/mnews/article/396/0000690890,게임과몰입 문화예술(미술) 프로그램 체험교육 모습. 게임문화재단 제공 게임문화재단은 문화체육관광부와 한국콘텐츠진흥원과 협력해 2024 게임과몰입 문화예술(음악·미술·체육) 프로그램 체험교육(체험교육)을 성료했다고 7
게임/리뷰,포모스,"넷마블, 카밤 신작 '킹 아서: 레전드 라이즈' 브랜드 페이지 오픈",https://n.news.naver.com/mnews/article/236/0000245286,"넷마블은 북미 자회사 카밤에서 개발 중인 신작 '킹 아서: 레전드 라이즈'의 공식 브랜드페이지를 오픈했다.'킹 아서: 레전드 라이즈'는 수집형 전략 RPG로 이용자들은 게임의 주인공인 아서가 엑스칼리버와 함께 모험을 시작하는 스토리를 직접 경험할 수 있다.또, '아서왕의 전설'에..."
게임/리뷰,데일리안,"네오플, 제주도 발달장애아동 재활치료비 3억6천만원 지원",https://n.news.naver.com/mnews/article/119/0002879056,"네오플은 제주특별자치도교육청 및 초록우산과 총 3억6000만원 규모의 업무 협약을 맺고 제주도 내 발달장애아동 재활치료비 지원사업을 실시한다고 7일 밝혔다. 네오플은 발달장애아동의 일상수행능력 강화 및 자립, 경제적"
게임/리뷰,연합뉴스,"넷마블, '킹 아서: 레전드 라이즈' 브랜드 페이지 공개",https://n.news.naver.com/mnews/article/001/0014968693,넷마블이 북미 자회사 카밤이 개발 중인 수집형 전략 역할수행게임(RPG) '킹 아서: 레전드 라이즈' 공식 브랜드 페이지를 오픈했다고 7일 밝혔다. '킹 아서'는 영국 아서 왕 전설에 등장하는 다양한 영웅을 획득해
게임/리뷰,데일리안,"넷마블, 신작 ‘킹 아서: 레전드 라이즈’ 공식 페이지 공개",https://n.news.naver.com/mnews/article/119/0002879049,넷마블이 북미 자회사 카밤에서 개발 중인 신작 ‘킹 아서: 레전드 라이즈’의 공식 브랜드페이지를 7일 공개했다. 킹 아서: 레전드 라이즈는 수집형 전략 RPG(역할수행게임)다. 이용자는 주인공 ‘아서’가 엑스칼리버와
게임/리뷰,비즈워치,"日상륙 25년차 NHN, 유일무이 韓직원의 생존비결은",https://n.news.naver.com/mnews/article/648/0000029547,"""NHN플레이아트 임직원 250명 중에서 제가 유일한 한국인입니다."" 국내 게임사 NHN이 2013년 일본 도쿄에 설립한 모바일 게임 스튜디오 'NHN플레이아트'의 유일한 한국인은 정우진 NHN 대표다. 2014년부"
게임/리뷰,스포츠월드,"‘크록스 신은 쿠키들’…쿠키런X크록스, 취향껏 꾸미고 콘테스트 참여까지",https://n.news.naver.com/mnews/article/396/0000690887,쿠키런: 킹덤이 패션 브랜드 크록스와 협업을 진행한다. 데브시스터즈 제공 쿠키런과 크록스가 만나 이색적인 컬래버레이션과 이벤트를 진행한다. 데브시스터즈는 모바일 역할수행게임(RPG) ‘쿠키런: 킹덤’이 패션 브랜드
게임/리뷰,아이뉴스24,"넷마블, 신작 '킹 아서: 레전드 라이즈' 공식 브랜드 페이지 오픈",https://n.news.naver.com/mnews/article/031/0000874388,넷마블은 북미 자회사 카밤에서 개발 중인 신작 '킹 아서: 레전드 라이즈'의 공식 브랜드 페이지를 오픈했다고 7일 밝혔다. 킹 아서: 레전드 라이즈는 수집형 전략 RPG다. 이용자는 주인공 아서가 엑스칼리버와 함께
게임/리뷰,지디넷코리아,"엑스오푸드빌리지, PC방 브랜드 디렉터 서희원 신임 대표로 선임",https://n.news.naver.com/mnews/article/092/0002347777,"엑스오푸드빌리지는 7일 서희원 비앤엠컴퍼니 대표를 신임 대표로 선임했다고 밝혔다. 서희원 신임 대표는 PC방 브랜드디렉터로 잘 알려진 인물로, 현재 PC방 컨설팅 전문 기업 비앤엠컴퍼니의 대표로도 활동하고 있다. P"
게임/리뷰,아이뉴스24,"네오플, 제주도 내 발달장애아동 재활치료비 지원사업 진행",https://n.news.naver.com/mnews/article/031/0000874385,네오플(대표 윤명진)은 제주특별자치도교육청(교육감 김광수)과 초록우산(회장 황영기)과 총 3억6000만원 규모의 업무 협약을 맺고 제주도 내 발달장애아동 재활치료비 지원사업을 실시한다고 7일 밝혔다. 회사 측은 발달
게임/리뷰,포모스,"네오플, 제주도 발달장애아동 재활치료비 3년간 지원",https://n.news.naver.com/mnews/article/236/0000245285,"네오플은 제주특별자치도교육청 및 초록우산과 총 3억 6000만 원 규모의 업무 협약을 맺고 제주도 내 발달장애아동 재활치료비 지원사업을 실시한다고 7일 밝혔다.네오플은 발달장애아동의 일상수행능력 강화 및 자립, 경제적 부담 감소를 돕기 위해 오는 2027년 9월까지 3년간 도내 만 18세 미만의 발달장애아동 총 40명에게..."
게임/리뷰,포모스,"홈런 클래시2, 보드람치킨과 제휴 프로모션 진행",https://n.news.naver.com/mnews/article/236/0000245284,"해긴은 모바일 야구 게임 '홈런 클래시2: 레전드 더비(이하 홈런 클래시2)'와 보드람치킨이 제휴 프로모션을 진행한다고 밝혔다.이번 프로모션은 31일까지 진행되며, 프로모션 기간 보드람치킨을 방문해 '홈런 클래시2' 세트를 주문하면 치킨과 함께 약 3만원 상당의 게임 아이템이 담긴 특별 쿠폰을..."
게임/리뷰,디지털데일리,"‘TL’ 초반 질주, 엔씨 글로벌 도약 마중물 될까",https://n.news.naver.com/mnews/article/138/0002183812,"글로벌 시장에 출시한 엔씨소프트(이하 엔씨)의 다중접속역할수행게임(MMORPG) ‘쓰론앤리버티(이하 TL)’가 초반 흥행에 성공했다. 당장의 실적 돌파구가 되는 것에서 나아가, 향후 엔씨 글로벌 진출의 마중물이 될"
게임/리뷰,디지털데일리,"[국감2024] 문체부, “콘솔·인디·AI 활용 게임 집중 지원”",https://n.news.naver.com/mnews/article/138/0002183811,문화체육관광부(문체부)가 콘솔·인디게임과 더불어 인공지능(AI) 활용 게임을 집중 지원해 글로벌 게임 강국으로 도약하겠다고 밝혔다. 7일 국회에 따르면 문체부는 국정감사를 앞두고 문화체육관광위원회에 제출한 업무현황보
게임/리뷰,디지털데일리,"컴투스 그룹, 생물 다양성 증진 위한 환경봉사활동 진행",https://n.news.naver.com/mnews/article/138/0002183808,컴투스 그룹이 생물 다양성 증진과 도심 속 자연 생태계 보전을 위한 비오톱 만들기 환경봉사활동을 진행했다. 지난 7일 국내 최초의 생태공원인 여의도 샛강생태공원에서 진행된 이번 봉사활동에는 컴투스 그룹 계열사 임직원
게임/리뷰,매일경제,"네오플, 발달장애아동 재활치료비 지원 3억6천만원 지원",https://n.news.naver.com/mnews/article/009/0005375282,네오플(대표 윤명진)은 제주특별자치도교육청(교육감 김광수)·초록우산(회장 황영기)과 총 3억 6000만 원 규모의 업무 협약을 맺고 제주도 내 발달장애아동 재활치료비 지원사업을 실시한다고 7일 밝혔다. 네오플은 발달
게임/리뷰,스포츠월드,"넥슨재단, 발달장애 청년 자립 지원 행사 개최…‘푸르메 낭만여행’",https://n.news.naver.com/mnews/article/396/0000690882,"넥슨재단이 발달장애 청년 자립 지원 프로젝트 ‘나누는맘 함께하고팜’ 캠페인의 일환으로 오프라인 행사 ‘떠나요, 푸르메 낭만여행’을 개최한다. 넥슨재단 제공 넥슨재단이 발달장애 청년의 자립을 지원하기 위해 행사를 개최"
게임/리뷰,포모스,'나 혼자만 레벨업:어라이즈 챔피언십' 개최...초대 우승자에 광광 선수 올라,https://n.news.naver.com/mnews/article/236/0000245283,"넷마블은 액션 게임 '나 혼자만 레벨업:어라이즈'의 첫 오프라인 대회 '나 혼자만 레벨업:어라이즈 챔피언십'을 지난 5일 서울 잠실 비타500 콜로세움에서 열었다.  게임 내 '시간의 전장'으로 실력을 겨루는 대회로, 지난달 25일 본선 관람 티켓 1차 판매 당시 100장이 5분..."
게임/리뷰,아이뉴스24,"원유니버스, 베트남 VN스튜디오 ISO27001 인증 취득",https://n.news.naver.com/mnews/article/031/0000874377,원유니버스는 베트남 현지 VN스튜디오가 국제 정보보안관리 표준인 ‘ISO27001’ 인증을 획득했다고 7일 밝혔다. ISO27001은 국제표준화기구(ISO)와 국제전기기술위원회(IEC)가 제정한 정보보안관리 체계에
게임/리뷰,매일경제,"크래프톤, PMPS 2024 시즌3‘ DRX 우승…7회 우승 달성",https://n.news.naver.com/mnews/article/009/0005375279,크래프톤(대표 김창한)은 ‘배틀그라운드 모바일 프로 시리즈 2024(이하 PMPS 2024) 시즌 3’에서 디알엑스(DRX)가 우승을 차지했다고 7일 밝혔다. PMPS는 국내 ‘배틀그라운드 모바일’ e스포츠의 최강팀
게임/리뷰,포모스,"""미술관을 닮은 NHN재팬 사옥 'NHN아틀리에'를 가다""",https://n.news.naver.com/mnews/article/236/0000245282,"일본 도쿄의 미나토구는 비즈니스 중심의 지역구로 알려져 있다.소니, 혼다 등 일본을 대표하는 기업들의 빌딩이 늘어서 있으며 아침과 저녁 시간에는 출퇴근하려는 샐러리맨들로 북적거리는 공간이다.이곳 미나토구 한편에는 NHN재팬의 사옥 NHN아틀리에가 자리잡고 있다.신사옥 NHN아틀리에는 NHN의 일본법인을 총괄하는 NHN재팬..."
게임/리뷰,포모스,"""게임과 애니메이션 성지 이케부쿠로에 자리 잡은 #콤파스 카페""",https://n.news.naver.com/mnews/article/236/0000245281,"일본 도쿄의 이케부쿠로 지역은 전자 상가가 밀집한 아키하바라 못지않게 게임과 애니메이션의 성지로 불린다.특히, 여성향 애니메이션과 게임 팬들을 위한 상가가 밀집돼 있어 일본의 여성 마니아들이 자주 방문하는 장소다.NHN플레이아트는 이케부쿠로와 오사카에서 자사가 서비스하는 모바일 대전 게임 '#콤파스'의 카페..."
게임/리뷰,디지털타임스,"네오플, 제주도 내 발달장애아동 재활치료 지원",https://n.news.naver.com/mnews/article/029/0002906970,"만 18세 미만 40명에 3년간 인당 연간 300만원 지급 네오플은 제주특별자치도교육청, 초록우산과 3억6000만원 규모의 업무협약을 체결하고 제주도 내 발달장애아동 재활치료비 지원사업을 실시한다고 7일 밝혔다. 네"
게임/리뷰,포모스,"[인터뷰]""NHN플레이아트는 일본의 문화를 지닌 개발진이 만들어 가는 회사""",https://n.news.naver.com/mnews/article/236/0000245280,"NHN의 일본 자회사 NHN플레이아트가 도쿄 미나토구에서 사옥 NHN아뜰리에서 신작 개발에 집중한다.이 회사는 현재 '디즈니 츠무츠무'를 개발하고 라인야후를 통해 10년 이상 서비스하고 있다.또, 일본의 젊은 세대를 겨냥한 대전 게임 '#콤파스'와 전 연령을 아우르는 퍼즐 게임 '요괴워..."
게임/리뷰,포모스,"NHN플레이아트, ""일본 시장에서 흥행 비결은 현재 팬덤 문화의 이해""",https://n.news.naver.com/mnews/article/236/0000245279,"NHN플레이아트가 도쿄 미나토구에 위치한 사옥 NHN아틀리에서 일본 시장의 성과와 함께 향후 전략에 대해 소개했다. 이 회사의 대표작이자 라인야후가 서비스하는 '디즈니 츠무츠무'를 비롯해 '요괴워치 뿌니뿌니', 대전"
과학 일반,연합뉴스,"""연구개발 예산 삭감·기관장 공백에 연구 현장 사기 저하""",https://n.news.naver.com/mnews/article/001/0014968848,"공공과기연구노조, 국정감사 정책요구안 발표 공공과학기술연구노동조합은 과학기술 분야 공공 연구기관에 대한 국정감사를 앞두고 7일 기자회견을 열어 정책 요구안을 발표했다. 노조는 ""대통령 말 한마디로 갑작스럽게 삭감됐던"
과학 일반,동아사이언스,"텔레픽스, 건국대와 원격탐사 연구·인재 양성 MOU",https://n.news.naver.com/mnews/article/584/0000028981,위성 토탈 솔루션 기업 텔레픽스가 건국대와 위성특화 인공지능(AI)과 원격탐사 관련 연구 및 인재 양성을 위한 업무협약(MOU)을 맺었다. 텔레픽스는 9월 30일 건국대 에코업(業)혁신융합대학사업단과 세계적인 원격탐
과학 일반,조선비즈,"[위고비 쇼크] 美 성인 비만율, 24년 만에 첫 감소세…“위고비·젭바운드 효과”",https://n.news.naver.com/mnews/article/366/0001022413,美CDC “2021~2023년 성인 비만율 2%p↓ 줄곧 상승하다 위고비 나오자 첫 감소세 비만약 사용 확대시 전 세계 비만율 줄어들 것” 지난 2000년도부터 미국에서 상승 곡선을 그리던 성인 비만율이 지난해 처음
과학 일반,연합뉴스,답변하는 이진숙 방통위원장,https://n.news.naver.com/mnews/article/001/0014968798,이진숙 방송통신위원장이 7일 오후 서울 여의도 국회 과학기술정보방송통신위원회 국정감사에서 위원 질문에 답하고 있다. 이 위원장은 야당이 단독 처리한 탄핵소추로 직무가 정지된 상태라 기관 증인이 아닌 일반 증인으로 출
과학 일반,아시아경제,AI가 바꾼 과학연구 패러다임‥노벨상도 수상?,https://n.news.naver.com/mnews/article/277/0005480872,"""AI 기술은 기초 과학 연구실과 산업 현장에서 새로운 발견의 시대를 열었다. 놀라운 정확도로 단백질 구조를 예측하는 능력은 생물학적 메커니즘을 이해하고 약물 개발을 가속하는 데 있어 전례 없는 진전으로 이어졌다."""
과학 일반,조선비즈,"조규홍 “현재 의료공백, 사회적 재난에 준해… 건보 재정 투입 불가피”",https://n.news.naver.com/mnews/article/366/0001022410,2024 국정감사 조규홍 보건복지부 장관이 “현재 한국 의료체계가 ‘사회적 재난에 준하는 상황’에 처했다”고 인정하며 “건강보험 재정 투입이 불가피하다”고 말했다. 조 장관은 7일 국회 보건복지위원회에서 열린 보건복
과학 일반,서울경제,"고바이오랩, 소아 자폐스펙트럼장애 대상 인체적용시험 돌입",https://n.news.naver.com/mnews/article/011/0004400027,고바이오랩(348150)이 소아 자폐스펙트럼장애 아동을 대상으로 인체적용시험에 돌입했다고 7일 밝혔다. 자폐스펙트럼장애는 대표적인 난치성 신경발달장애로 현재까지 명확한 치료법이 없다. 고바이오랩은 오미애 경희대학교병
과학 일반,동아사이언스,그린란드 빙하에서 찾아낸 백두산 '천년분화'의 흔적,https://n.news.naver.com/mnews/article/584/0000028980,국내 연구진이 그린란드 빙하에서 1000년 전 일어났던 강력한 백두산 화산폭발의 양상을 새롭게 밝혀냈다. 일명 '천년분화'라고 불리는 강력한 폭발이 추운 겨울철 1~2개월 간격으로 두 번에 걸쳐 발생한 것으로 나타났
과학 일반,매일경제,"대한항공, 한국발 기내식에 국산 식자재 사용 늘린다",https://n.news.naver.com/mnews/article/009/0005375346,올해 국산 식자재 비중 64%로 국산 농·수산물 소비 활성화 기여 대한항공이 한국발 국제선 출발편 기내식에 쓰이는 국산 식자재 비중을 지속적으로 늘려 나가기로 했다고 7일 밝혔다. 대한항공은 기내식 식자재 국산화를
과학 일반,뉴스1,"""의료공백 수습에 건강보험 2.3조 투입""…복지장관 ""불가피""",https://n.news.naver.com/mnews/article/421/0007829000,"강승지 임세원 조유리 기자 = 의정갈등이 8개월째 접어든 가운데 의료공백 사태 수습에 투입됐거나 활용될 국민건강보험 재정이 2조3448억원으로 집계됐다. 이에 대해 조규홍 보건복지부 장관은 ""현재 의료상황은 사회적"
과학 일반,전자신문,"[단독]상승세 탔던 출연연 기술료 수입, 5년만에 처음 꺾였다",https://n.news.naver.com/mnews/article/030/0003245314,"지난해 정부 출연연구기관의 기술이전 수입료가 처음으로 감소세로 전환했다. 기술 사업화를 뒷받침하는 전문 인력도 5년간 늘지 않았다. 기업 수요 중심의 기술개발로 국가 연구개발(R&D)의 효율성을 높이고, 출연연의 전"
과학 일반,뉴스1,"울산 북구 인근 해역서 2.2 지진…""피해 없을 것""",https://n.news.naver.com/mnews/article/421/0007828986,"황덕현 기후환경전문기자 = 7일 오후 3시 9분쯤 울산 북구 동북동쪽 약 26㎞ 해역에서 리히터 규모 2.2 지진이 발생했다. 기상청에 따르면 이 지진은 동경 129.63도, 북위 35.67도 지점에서 발생했다. 발"
과학 일반,디지털타임스,가속기·발사체 등 구축형 R&D사업에 `사전심사제도` 도입 추진,https://n.news.naver.com/mnews/article/029/0002906987,"과기정통부, 과기기본법 개정안 입법예고 사전검토 및 계획변경 가능..내달 18일까지 과학기술정보통신부는 연구개발(R&D) 사업 예비타당성조사(예타) 폐지에 따라 가속기나 우주발사체 등 대규모 구축형 R"
과학 일반,서울신문,괴물 블랙홀이 뿜는 제트가 신성을 만든다 [아하! 우주],https://n.news.naver.com/mnews/article/081/0003485245,"지구에서 처녀자리 방향으로 5,300만 광년 떨어진 M87 (메시에 87) 혹은 처녀자리 A 은하는 거리에도 불구하고 아주 오래전부터 알려진 은하다. 1781년에 프랑스의 천문학자 샤를 메시에가 처음 관측해서 메시에"
과학 일반,연합뉴스,국정감사 참석한 이진숙 방통위원장,https://n.news.naver.com/mnews/article/001/0014968696,이진숙 방송통신위원장(오른쪽)이 7일 오후 서울 여의도 국회 과학기술정보방송통신위원회 국정감사에 참석해 물을 마시고 있다. 이 위원장은 야당이 단독 처리한 탄핵소추로 직무가 정지된 상태라 기관 증인이 아닌 일반 증인
